{
  "version": 1,
  "generated_from_round": "round-009",
  "authority": "advisory_only",
  "summary": "Advisory organism catalog for round-009 roadmap candidates. Organisms compose molecule hints and atom candidates, but do not claim runtime support.",
  "organisms": [
    {
      "organism_id": "invoice_line_item_billing",
      "korean_name": "청구서 항목 과금 문서",
      "why": "고객과 문서 식별자, 반복 청구 항목, 합계, 출력 문서가 함께 필요한 billing workflow를 설명한다.",
      "primary_workflow": "draft_invoice_to_reviewable_billing_document",
      "required_molecule_ids": ["metadata_header", "repeating_row_input_block", "line_item_total_block", "printable_document_region", "protected_summary_region"],
      "supporting_atom_ids": ["join_lookup", "group_summarize", "append_structured_rows", "extend_table_formulas", "generate_printable_form", "protect_formula_cells", "add_data_validation", "normalize_headers"],
      "planned_or_unsupported_atom_ids": ["generate_printable_form", "protect_formula_cells", "add_data_validation", "normalize_headers"],
      "verifier_focus": ["line item total matches source rows", "metadata appears in output region", "formula and summary cells remain protected"],
      "fixture_priority": "p0",
      "advisory_status": "advisory_only",
      "rationale": "청구서는 단순 table append가 아니라 document identity, line item calculation, printable output이 함께 있어야 organism으로 성립한다."
    },
    {
      "organism_id": "expense_reimbursement",
      "korean_name": "경비 정산 문서",
      "why": "직원이나 프로젝트 기준 경비 항목을 모아 reimbursable total과 검토 가능한 문서로 만드는 workflow다.",
      "primary_workflow": "submit_expense_items_for_reimbursement_review",
      "required_molecule_ids": ["metadata_header", "repeating_row_input_block", "line_item_total_block", "printable_document_region", "protected_summary_region"],
      "supporting_atom_ids": ["group_summarize", "append_structured_rows", "extend_table_formulas", "generate_printable_form", "protect_formula_cells", "add_data_validation", "normalize_headers"],
      "planned_or_unsupported_atom_ids": ["generate_printable_form", "protect_formula_cells", "add_data_validation", "normalize_headers"],
      "verifier_focus": ["eligible expense rows roll into reimbursement total", "required metadata is present", "output document reflects latest totals"],
      "fixture_priority": "p1",
      "advisory_status": "advisory_only",
      "rationale": "invoice와 유사하지만 고객 과금이 아니라 제출/승인 가능한 비용 정산 산출물이 핵심이다."
    },
    {
      "organism_id": "purchase_order_control",
      "korean_name": "구매 주문 관리 문서",
      "why": "구매 항목, 공급자 식별자, 주문 상태, 출력 가능한 PO 문서를 하나의 control workflow로 묶는다.",
      "primary_workflow": "create_and_track_purchase_order_status",
      "required_molecule_ids": ["metadata_header", "repeating_row_input_block", "line_item_total_block", "status_pipeline_block", "printable_document_region"],
      "supporting_atom_ids": ["join_lookup", "group_summarize", "append_structured_rows", "extend_table_formulas", "generate_printable_form", "add_data_validation", "normalize_headers"],
      "planned_or_unsupported_atom_ids": ["generate_printable_form", "add_data_validation", "normalize_headers"],
      "verifier_focus": ["PO line totals match item rows", "allowed status values drive status summary", "supplier metadata is carried into the document"],
      "fixture_priority": "p1",
      "advisory_status": "advisory_only",
      "rationale": "구매 주문은 문서형 molecule에 상태 파이프라인이 결합될 때 invoice/expense와 구분된다."
    },
    {
      "organism_id": "monthly_budget_control",
      "korean_name": "월간 예산 통제표",
      "why": "월별 계획 대비 실제 지출, variance, 초과 예외, 다음 기간 연속성을 관리한다.",
      "primary_workflow": "roll_budget_period_and_review_variance",
      "required_molecule_ids": ["period_copy_block", "carry_forward_summary_block", "formula_extension_block", "threshold_exception_block", "protected_summary_region"],
      "supporting_atom_ids": ["group_summarize", "highlight_threshold", "copy_period_sheet", "roll_forward_period", "extend_table_formulas", "protect_formula_cells"],
      "planned_or_unsupported_atom_ids": ["copy_period_sheet", "roll_forward_period", "protect_formula_cells"],
      "verifier_focus": ["new period preserves formulas", "closing values carry into next period", "budget overruns are highlighted"],
      "fixture_priority": "p0",
      "advisory_status": "advisory_only",
      "rationale": "예산은 기간 복사와 이월/마감 연속성, 임계값 예외가 동시에 필요하므로 단순 summary가 아니다."
    },
    {
      "organism_id": "cash_flow_monitor",
      "korean_name": "현금 흐름 모니터",
      "why": "opening balance, inflow, outflow, closing balance의 기간별 연속성을 확인한다.",
      "primary_workflow": "track_opening_to_closing_cash_continuity",
      "required_molecule_ids": ["period_copy_block", "carry_forward_summary_block", "formula_extension_block", "protected_summary_region"],
      "supporting_atom_ids": ["group_summarize", "copy_period_sheet", "roll_forward_period", "extend_table_formulas", "protect_formula_cells"],
      "planned_or_unsupported_atom_ids": ["copy_period_sheet", "roll_forward_period", "protect_formula_cells"],
      "verifier_focus": ["closing balance equals next opening balance", "inflow/outflow formulas remain intact", "summary is protected"],
      "fixture_priority": "p0",
      "advisory_status": "advisory_only",
      "rationale": "cash flow는 예산처럼 기간형이지만 핵심 검증은 초과 표시보다 balance continuity다."
    },
    {
      "organism_id": "attendance_register",
      "korean_name": "출석부",
      "why": "사람과 날짜 또는 수업 회차가 교차하는 matrix에서 출석 상태와 합계를 관리한다.",
      "primary_workflow": "mark_attendance_across_period_grid",
      "required_molecule_ids": ["period_copy_block", "matrix_growth_block", "timeline_grid_projection_block", "protected_summary_region"],
      "supporting_atom_ids": ["group_summarize", "copy_period_sheet", "protect_formula_cells", "add_data_validation", "normalize_headers"],
      "planned_or_unsupported_atom_ids": ["copy_period_sheet", "protect_formula_cells", "add_data_validation", "normalize_headers"],
      "verifier_focus": ["new dates or learners are included in totals", "attendance statuses are valid", "period grid formulas remain intact"],
      "fixture_priority": "p0",
      "advisory_status": "advisory_only",
      "rationale": "출석부는 row append보다 matrix growth와 period grid 검증이 중심이다."
    },
    {
      "organism_id": "timesheet_hours_log",
      "korean_name": "근무 시간 기록표",
      "why": "기간별 업무 시간 행을 추가하고 합계와 overtime 같은 계산을 유지한다.",
      "primary_workflow": "log_period_hours_and_summarize_totals",
      "required_molecule_ids": ["period_copy_block", "repeating_row_input_block", "formula_extension_block", "protected_summary_region"],
      "supporting_atom_ids": ["group_summarize", "copy_period_sheet", "append_structured_rows", "extend_table_formulas", "protect_formula_cells", "add_data_validation"],
      "planned_or_unsupported_atom_ids": ["copy_period_sheet", "protect_formula_cells", "add_data_validation"],
      "verifier_focus": ["new time rows are included in totals", "hour formulas extend to appended rows", "period copies preserve summary formulas"],
      "fixture_priority": "p0",
      "advisory_status": "advisory_only",
      "rationale": "timesheet은 matrix보다 반복 행 입력과 기간별 formula preservation이 우선이다."
    },
    {
      "organism_id": "project_timeline_tracker",
      "korean_name": "프로젝트 타임라인 추적표",
      "why": "task의 시작/종료, phase, 상태를 timeline view에 반영해 일정 진행을 추적한다.",
      "primary_workflow": "project_tasks_to_timeline_view",
      "required_molecule_ids": ["timeline_grid_projection_block", "period_copy_block", "status_pipeline_block", "formula_extension_block"],
      "supporting_atom_ids": ["group_summarize", "copy_period_sheet", "extend_table_formulas", "add_data_validation"],
      "planned_or_unsupported_atom_ids": ["copy_period_sheet", "add_data_validation"],
      "verifier_focus": ["task date changes move timeline projection", "new tasks appear in timeline", "status summary matches task rows"],
      "fixture_priority": "p1",
      "advisory_status": "advisory_only",
      "rationale": "프로젝트 타임라인은 날짜 값을 단순 저장하지 않고 grid/timeline projection으로 변환해야 한다."
    },
    {
      "organism_id": "shift_roster_planner",
      "korean_name": "근무 교대 편성표",
      "why": "사람과 날짜/shift grid를 만들어 근무 배정과 coverage를 관리한다.",
      "primary_workflow": "assign_people_to_shift_grid",
      "required_molecule_ids": ["timeline_grid_projection_block", "period_copy_block", "matrix_growth_block", "protected_summary_region"],
      "supporting_atom_ids": ["group_summarize", "copy_period_sheet", "protect_formula_cells", "add_data_validation", "normalize_headers"],
      "planned_or_unsupported_atom_ids": ["copy_period_sheet", "protect_formula_cells", "add_data_validation", "normalize_headers"],
      "verifier_focus": ["shift assignments remain within valid choices", "coverage totals include new shifts", "period copy preserves roster structure"],
      "fixture_priority": "p1",
      "advisory_status": "advisory_only",
      "rationale": "shift roster는 attendance와 비슷하지만 입력 의미가 출석 기록이 아니라 미래 배정과 coverage다."
    },
    {
      "organism_id": "construction_cost_tracker",
      "korean_name": "공사 비용 추적표",
      "why": "공정이나 phase별 비용 항목, 누적 지출, 예산 초과 예외를 관리한다.",
      "primary_workflow": "track_phase_costs_against_budget",
      "required_molecule_ids": ["timeline_grid_projection_block", "line_item_total_block", "carry_forward_summary_block", "threshold_exception_block"],
      "supporting_atom_ids": ["group_summarize", "highlight_threshold", "protect_formula_cells", "roll_forward_period", "append_structured_rows"],
      "planned_or_unsupported_atom_ids": ["protect_formula_cells", "roll_forward_period"],
      "verifier_focus": ["phase totals equal cost line items", "budget exceptions are flagged", "carry-forward totals remain consistent"],
      "fixture_priority": "p1",
      "advisory_status": "advisory_only",
      "rationale": "공사비는 timeline과 비용 line item, 누적 예산 통제가 결합되는 organism이다."
    },
    {
      "organism_id": "inventory_movement_log",